Episode Number,Episode Title,Question
115,115: Semi-Immortal 35-Year-Olds on Mars,How do I turn my imagination off long enough to sleep?
116,116: Do Not Enter the Craft Fort! (w/ Caitlin Hofmeister!),How do you surprise loved ones in small apartments?
116,116: Do Not Enter the Craft Fort! (w/ Caitlin Hofmeister!),What is the line between archaeology and grave robbing?
116,116: Do Not Enter the Craft Fort! (w/ Caitlin Hofmeister!),What is the appropriate time to get into the Christmas season?
117,117: Lightsaber Your Tiny House (w/ Katherine Green!),What do you do with cereal dust?
117,117: Lightsaber Your Tiny House (w/ Katherine Green!),What happens if kid doesn't like dog?
117,117: Lightsaber Your Tiny House (w/ Katherine Green!),How did cave people cut their fingernails?
118,118: Heavy Baby Bib! (w/ Alex Goldman!),What counts as significant change?
118,118: Heavy Baby Bib! (w/ Alex Goldman!),How do you know who you're supposed to buy presents for?
118,118: Heavy Baby Bib! (w/ Alex Goldman!),Is it weird to let someone know you're thinking of them?
119,119: Water Is Dry (w/ Greg Miller!),Why don't I have a lifelong friend?
119,119: Water Is Dry (w/ Greg Miller!),How can I become ruler of everyone with my name?
119,119: Water Is Dry (w/ Greg Miller!),What are snails trying to flee?
119,119: Water Is Dry (w/ Greg Miller!),?
120,120: Snake Cuddle Time,How do I memorize all the birds?
120,120: Snake Cuddle Time,Should I join the Navy?
120,120: Snake Cuddle Time,How do you eat trail mix?
121,121: Every Plum Has Its Thorn,What is the point of love if it always ends?
121,121: Every Plum Has Its Thorn,How do I scream?
121,121: Every Plum Has Its Thorn,How do I stop a surprise avian ring delivery?
122,122: The Last Brand Deal,Am I too young to be self-supervised?
122,122: The Last Brand Deal,Can I throw away my dead grandmother's sponges?
122,122: The Last Brand Deal,How do I make a personal retirement PowerPoint for Rick?
123,123: The Incredible Glamorous Hulk,How do fish get into lakes?
123,123: The Incredible Glamorous Hulk,How do I stay aware of things without giving them views?
123,123: The Incredible Glamorous Hulk,Do aliens communicate with sign language?
124,124: Liars and Litterers and Thieves,Can I hoard stolen goods?
124,124: Liars and Litterers and Thieves,How do I make sure I don't become a racist?
124,124: Liars and Litterers and Thieves,How do I get cookies?
125,125: Book Hangovers (w/ Sarah Urist Green!),How do people love reading when it hurts?
125,125: Book Hangovers (w/ Sarah Urist Green!),How do you make friends in art class?
125,125: Book Hangovers (w/ Sarah Urist Green!),How do you proceed after accidentally slow dancing with someone?
126,126: The Space Alien Orange Peel Health Craze,Should I spend prom at Target or break up my friends?
126,126: The Space Alien Orange Peel Health Craze,How does Legolas never run out of arrows?
126,126: The Space Alien Orange Peel Health Craze,What would happen if all plants ceased to exist?
127,127: How to Befriend a Crow,Should I follow my dreams of having strange animal friends?
127,127: How to Befriend a Crow,What would happen if I pee in this humidifier?
127,127: How to Befriend a Crow,Is it disrespectful to look at someone while they yawn?
128,128: AARTcoin,Are hitchhiker ants okay?
128,128: AARTcoin,How do I tell my parents I want to study economics?
128,128: AARTcoin,Who is responsible for calling back after a dropped call?
129,129: The Worst Guest Books,Am I not invited to my aunt's wedding?
129,129: The Worst Guest Books,Do I tell my friend I clogged their toilet?
129,129: The Worst Guest Books,Is there an Olympic Hall of Urine?
130,130: The LaCroix Boix,How much sand is there?
130,130: The LaCroix Boix,How do I unfriend the murder?
130,130: The LaCroix Boix,How does one finance baby?
131,131: Space War Fears,How do I handle the surprise baby hamsters?
131,131: Space War Fears,Can I take things from someone else's shopping cart?
131,131: Space War Fears,Are we all gonna die in a space war?
132,132: Schrödinger's Floor,Why do we need constant mental stimuli?
132,132: Schrödinger's Floor,How do I clean my room?
132,132: Schrödinger's Floor,Can I still be friends with my ex's family?
133,133: Fork Bouquet,What should I do with all these plastic forks?
133,133: Fork Bouquet,At what age do you grow out of regret?
133,133: Fork Bouquet,Do ants sleep?
134,134: The Millennial Avocadome,Are rocks actually soft?
134,134: The Millennial Avocadome,What are Pop-Tarts?
134,134: The Millennial Avocadome,My boyfriend's ex is dating my ex?
134,134: The Millennial Avocadome,?
134,134: The Millennial Avocadome,?
135,135: Danger Noodles and Little Boops (w/ Emily Graslie!),How do you throw away a trash can?
135,135: Danger Noodles and Little Boops (w/ Emily Graslie!),Which animals have the most awkward adolescent phase?
135,135: Danger Noodles and Little Boops (w/ Emily Graslie!),Are humans an invasive species?
136,136: Wake Up Canadian,What should I wear to Hamilton?
136,136: Wake Up Canadian,"If you work a four-day week, do you still get a hump day?"
136,136: Wake Up Canadian,Are books a distorted mirror?
137,137: Manhole & Me,Why am I in Seattle?
137,137: Manhole & Me,Why are bricks stacked that way in walls?
137,137: Manhole & Me,Is nihilism hilarious?
138,138: Snappy the T. rex,Do dead bodies get sunburned?
138,138: Snappy the T. rex,How do you science a baby?
138,138: Snappy the T. rex,Who were the first fans?
139,139: What If the Moon Was One of Us,What should I spend my birthday money on?
139,139: What If the Moon Was One of Us,Is hope a dinosaur?
139,139: What If the Moon Was One of Us,What do I do with 23 plastic molds of my teeth?
140,140: The Spoon in the Road,How often should I try new food places?
140,140: The Spoon in the Road,How do you break up with someone without crushing them?
140,140: The Spoon in the Road,What's the best way to greet a new neighbor?
141,141: Gretel's Instagram Regrets (w/ How to ADHD!),Am I accidentally a horrible person?
141,141: Gretel's Instagram Regrets (w/ How to ADHD!),"What should I do with 1,000 business cards?"
141,141: Gretel's Instagram Regrets (w/ How to ADHD!),How do I not break my grandmother's heart?
142,142: Don't Harsh on My Yums,Why do people like ant colonies?
142,142: Don't Harsh on My Yums,What do I do about customers who come in right before close?
142,142: Don't Harsh on My Yums,Where do bugs go when it rains?
143,143: Eleven Peas,Are there any good billionaires?
143,143: Eleven Peas,How do I get better at contracts?
143,143: Eleven Peas,What are the rules of doctor-patient small talk?
144,"144: Great, Robust Berries (w/ Jenny Lawson!)",What is your innocuous life curse?
144,"144: Great, Robust Berries (w/ Jenny Lawson!)",What should I read when I've outgrown YA?
144,"144: Great, Robust Berries (w/ Jenny Lawson!)",How do I survive without my coping mechanism?
145,145: Wait to Panic,What should I do with the ends of bread?
145,145: Wait to Panic,How do you know when you get to the end of the galaxy?
145,145: Wait to Panic,How did they livestream the lunar landing?
146,146: Skate with Snakes,How did people tell time before clocks?
146,146: Skate with Snakes,Should I go to a thing just to avoid FOMO?
146,146: Skate with Snakes,How do I deal with popsicle haters?
147,147: Celebrities on a Plane,Should I tell my boyfriend he has a fandom?
147,147: Celebrities on a Plane,What do you do in a non-reciprocal high five situation?
147,147: Celebrities on a Plane,Why are football scarves so short?
148,148: Hiding Nuts,Why is there no $25 bill?
148,148: Hiding Nuts,What happens to a person’s consciousness when they're teleported?
148,148: Hiding Nuts,What does space smell like?
149,149: Let's Be Mermaids,Where would you put an extra eye?
149,149: Let's Be Mermaids,How do I survive at home alone?
149,149: Let's Be Mermaids,Why is underwear a pair?
150,150: Spicy Limes,What should I do with this tooth?
150,150: Spicy Limes,How do I keep a secret?
150,150: Spicy Limes,How do I get out of the shadow of my parents’ triumphs?
151,151: Dapper Dudes,How do I tell my boyfriend he's beautiful?
151,151: Dapper Dudes,Can I talk to my cousin's ex?
151,151: Dapper Dudes,How do I figure out my music taste?
152,"152: Thank You, Hot Fries!!",Are we living in a simulation?
152,"152: Thank You, Hot Fries!!",Are there other types of teeth?
152,"152: Thank You, Hot Fries!!",What should I do with this bowl?
153,153: Perfectly Normal Art Projects (w/ Sarah Urist Green!),Can I use being an artist as an excuse for being weird?
153,153: Perfectly Normal Art Projects (w/ Sarah Urist Green!),How do museum benches work?
153,153: Perfectly Normal Art Projects (w/ Sarah Urist Green!),What is the best advice a parent can give their child?
154,154: You're Doing Great (w/ Tessa Violet!),What do I do when I'm asked to lie to children?
154,154: You're Doing Great (w/ Tessa Violet!),Should I tell my boss I'm obsessed with her famous son?
154,154: You're Doing Great (w/ Tessa Violet!),Why is Dodie so much better at stuff than I am?
155,155: Drunk Fruit Squirrels,Can I wear my Tuesday shirt on other days?
155,155: Drunk Fruit Squirrels,How do I give advice that doesn't hurt feelings but is still helpful?
155,155: Drunk Fruit Squirrels,Did I steal this plant?
156,156: There Is a Diversity of Opinions Among the People Who Drive This Car,How can I avoid having to dress up for Halloween?
156,156: There Is a Diversity of Opinions Among the People Who Drive This Car,What do you do when your friends make fun of your friend?
156,156: There Is a Diversity of Opinions Among the People Who Drive This Car,How do I artfully display my rib?
157,157: It's My Soundtrack! (w/ Rosianna Halse Rojas!),Should I treasure my books more?
157,157: It's My Soundtrack! (w/ Rosianna Halse Rojas!),Can I learn to sleep standing up like a horse?
157,157: It's My Soundtrack! (w/ Rosianna Halse Rojas!),Does everyone have an eighties disco playing in their head?
158,158: President Alligator,Why do people hate raisins?
158,158: President Alligator,Is U2 a boy band?
158,158: President Alligator,How do I make friends with the people I work with?
159,159: The Horrifying Five-Tined Fork,How do I get out of this maze?
159,159: The Horrifying Five-Tined Fork,What do I do with this cello?
159,159: The Horrifying Five-Tined Fork,When will I stop having to call my mom to help me figure out life?
160,160: You Are Not My Bus,Where should I look when I'm talking to someone?
160,160: You Are Not My Bus,Will aliens ride our roller coasters when we're all dead?
160,160: You Are Not My Bus,Should guests help do the dishes?
161,161: Your Dabbing Uncle Hank,At what point do I fail?
161,161: Your Dabbing Uncle Hank,What should I do while I'm waiting to be sawed in half?
161,161: Your Dabbing Uncle Hank,Should I eat the fungus?
162,162: The Fault in Our Mars,What tricks can babies do?
162,162: The Fault in Our Mars,Should I become a space lawyer?
162,162: The Fault in Our Mars,Did I let a guy steal my car?
163,163: A Man's Man's Guide to Potassium,How do I convince my boyfriend not to grow a mullet?
163,163: A Man's Man's Guide to Potassium,"What do I do with this small, hot towel?"
163,163: A Man's Man's Guide to Potassium,Should I destroy my sad friend in Words with Friends?
164,164: The Kurt Vonnegut Special,How much money should I ask for?
164,164: The Kurt Vonnegut Special,How do I talk to my crush?
164,164: The Kurt Vonnegut Special,Will climate change make mountains shorter?
165,165: We're Gonna Make It,What would it feel like to be microwaved?
165,165: We're Gonna Make It,How do I get my dad to chill on Facebook?
165,165: We're Gonna Make It,How do I confront my roommate about the ferret oatmeal baths?
166,166: Do Not Enter the Secret Room,Why are human babies so useless?
166,166: Do Not Enter the Secret Room,What's with Ohio's salad crackers?
166,166: Do Not Enter the Secret Room,Why can't I use an umbrella in the snow?
167,167: A Song Called Shhh,What should I do about the accordion player outside?
167,167: A Song Called Shhh,Should I take a trip to a strange city by myself?
167,167: A Song Called Shhh,How do I get in the secular Christmas spirit?
168,"168: All of Them, Including LinkedIn",Where did all the websites go?
168,"168: All of Them, Including LinkedIn",How do you solve a problem like Maria?
168,"168: All of Them, Including LinkedIn",What's my brand?
169,169: A Perpetual Christmas Civilization That Orbits the Sun,Why do we put people on pedestals?
169,169: A Perpetual Christmas Civilization That Orbits the Sun,How can I get better at mornings?
169,169: A Perpetual Christmas Civilization That Orbits the Sun,What should I hide under the floorboards?
170,"170: You Can Trust Us, We're Aliens",How do I teach a class I know almost nothing about?
170,"170: You Can Trust Us, We're Aliens",What if humans had tails?
170,"170: You Can Trust Us, We're Aliens",Why can’t you walk through a drive-through?
171,171: Our Pasta-Making Robot Overlords,What do I do when all my friends hang out without me?
171,171: Our Pasta-Making Robot Overlords,Are beans basically small potatoes?
171,171: Our Pasta-Making Robot Overlords,How do you smuggle a swan internationally?
172,172: Get in Touch with Your Glitter Side,How do I stop receiving so many Peeps?
172,172: Get in Touch with Your Glitter Side,Why do I have to sneeze immediately after I put on mascara?
172,172: Get in Touch with Your Glitter Side,How do I use a bus?
173,"173: My Ghost Date, Timothy",What should I do at prom by myself?
173,"173: My Ghost Date, Timothy",Can ghosts ride in cars?
173,"173: My Ghost Date, Timothy",How do you end a voicemail?
174,"174: The Mysterious ""Stolen"" Car",Am I too old to race down hotel hallways?
174,"174: The Mysterious ""Stolen"" Car",Is there a stranger in my attic?
174,"174: The Mysterious ""Stolen"" Car",How do you make plans with a subgroup of friends?
175,175: Burn It All!!!!,What should I put in my journal?
175,175: Burn It All!!!!,Should I sign a card for someone I don't know?
175,175: Burn It All!!!!,What do I do when strangers tell me my shoes are untied?
176,176: The Celebrity Life Coaches of Your Dreams,Should penguins go to Mars?
176,176: The Celebrity Life Coaches of Your Dreams,Why do we chew rubber?
176,176: The Celebrity Life Coaches of Your Dreams,"Is this frantic, indecisive squirrel okay?"
177,177: Gum Influencers,How do I know if I'm being a know-it-all?
177,177: Gum Influencers,How do we survive the 2020 presidential election?
177,177: Gum Influencers,At what point does a flying fish become a swimming bird?
178,178: Snack Man! (Live at PodCon!),How do I propose to my girlfriend if I can't get down on one knee?
178,178: Snack Man! (Live at PodCon!),How do I get rid of a bad nickname?
178,178: Snack Man! (Live at PodCon!),Should I cause chaos?
179,179: The Queen's Dream Job (w/ Danielle Bainbridge!),Should I pretend to dislike my sister?
179,179: The Queen's Dream Job (w/ Danielle Bainbridge!),How do I not put too much pressure on my dream job?
179,179: The Queen's Dream Job (w/ Danielle Bainbridge!),How much salt does it take to mummify a person?
180,180: The Bird Thunderdome (w/ Katherine Green!),How do I win the bird hospitality battle?
180,180: The Bird Thunderdome (w/ Katherine Green!),Are the keys part of the car?
180,180: The Bird Thunderdome (w/ Katherine Green!),How do I get better at creative writing?
181,181: Comforting Existential Crises (w/ Jana Hisham!),When are you too old to read YA?
181,181: Comforting Existential Crises (w/ Jana Hisham!),How do you get lost in a healthy way?
181,181: Comforting Existential Crises (w/ Jana Hisham!),Are there entire civilizations on the bottom of the ocean?
182,182: It’s All Hermeneutics to Me,Are our voices actually slightly deeper?
182,182: It’s All Hermeneutics to Me,What's going on with paperclips?
182,182: It’s All Hermeneutics to Me,How do I keep out the chickens?
183,183: John's Subway Safety Procedures,How do you stay focused on one project for a long time?
183,183: John's Subway Safety Procedures,Should I tell this stranger to examine their zipper?
183,183: John's Subway Safety Procedures,Are there other kinds of ketchup?
184,184: Lady with the Time Piece (w/ Helen Zaltzman!),How do you deal with saying something wrong publicly?
184,184: Lady with the Time Piece (w/ Helen Zaltzman!),How far does a squirrel's social sphere extend?
184,184: Lady with the Time Piece (w/ Helen Zaltzman!),Can I ask my friend questions about her surgery?
185,185: Time-Traveling Battle Axes,Who owns the bones?
185,185: Time-Traveling Battle Axes,Why are American coins so confusing?
185,185: Time-Traveling Battle Axes,Would dragon eggs have scales?
186,186: The Morlon Wiley Way In,How do you open an envelope?
186,186: The Morlon Wiley Way In,How do companies turn attention into money?
186,186: The Morlon Wiley Way In,What's the deal with the itsy bitsy spider?
187,187: The Uncle Mike Way of Life,How do I fairly distribute my hugs?
187,187: The Uncle Mike Way of Life,Could black holes suck up the Earth?
187,187: The Uncle Mike Way of Life,How do I change the way I walk?
187,187: The Uncle Mike Way of Life,How can I support my stressed-out dad?
187,187: The Uncle Mike Way of Life,What's the best way to receive negative performance reviews?
187,187: The Uncle Mike Way of Life,What do I do if I vomit at work?
187,187: The Uncle Mike Way of Life,Why don't ants die when they fall from heights?
187,187: The Uncle Mike Way of Life,Who should play me in the movie of my life?
188,188: The Imperial Bridal March,What is the proper thing to do with abandoned table beer?
188,188: The Imperial Bridal March,What's the best way to spend time on trains?
188,188: The Imperial Bridal March,How do I move on when my favorite show ends?
188,188: The Imperial Bridal March,How do I sleep in without waking up with a backache?
188,188: The Imperial Bridal March,"Should I have played ""The Imperial March"" at a wedding?"
188,188: The Imperial Bridal March,Are you allowed to use the soap in another person's shower?
188,188: The Imperial Bridal March,Why do some carrots taste earthier than others?
188,188: The Imperial Bridal March,Why isn't there a Neptune Day?
188,188: The Imperial Bridal March,What should I do about Gavin's grass ideas?
189,189: Weird Statistics,Do a lot of people swerve?
189,189: Weird Statistics,What constitutes black coffee?
189,189: Weird Statistics,How do I make mac and cheese if I don't have milk?
189,189: Weird Statistics,What is the rage/luck relationship when it comes to pennies?
189,189: Weird Statistics,How do I find out my therapist's name?
189,189: Weird Statistics,Should I give books to people who don't like to read?
189,189: Weird Statistics,How should I deal with family drama?
189,189: Weird Statistics,How do I get my charger back?
189,189: Weird Statistics,Is it time to rip off the Band-Aid?
190,190: The Top Three Best Things About Sneezing Underwater,How do I get people to remember who I am?
190,190: The Top Three Best Things About Sneezing Underwater,What do I do about the Red Bull I spilled in a kid's backpack?
190,190: The Top Three Best Things About Sneezing Underwater,How do I deal with my girlfriend's unaccepting parents?
190,190: The Top Three Best Things About Sneezing Underwater,Does cold water boil faster than hot water?
190,190: The Top Three Best Things About Sneezing Underwater,Which way should a staple face?
190,190: The Top Three Best Things About Sneezing Underwater,Is it possible to sneeze underwater?
190,190: The Top Three Best Things About Sneezing Underwater,What is the correct way to eat the bottom of a popsicle?
190,190: The Top Three Best Things About Sneezing Underwater,How do I get out of being grounded?
190,190: The Top Three Best Things About Sneezing Underwater,"Can I bring my boyfriend to a thing even though it says ""spouses only""?"
191,191: The Engagement Duck,What is the dress code if there is no dress code?
191,191: The Engagement Duck,Where can I be anxious at work?
191,191: The Engagement Duck,What should I do with 72 tall vases?
191,191: The Engagement Duck,How can I avoid having to do dishes?
191,191: The Engagement Duck,How can I grow my own vegetables if the Sun is in the wrong place?
191,191: The Engagement Duck,How do I sort out my priorities?
191,191: The Engagement Duck,How do I tell my girlfriend's mother we aren't ready for a duck?
191,191: The Engagement Duck,Is there a polite way to ask someone to eat quietly?
191,191: The Engagement Duck,How and where should I conceal the dream rock?
192,192: Raised on a Yacht (w/ Vanessa Hill of BrainCraft!),Vanessa Hill of BrainCraft joins Hank to answer your questions! Has it ever not been raining?
192,192: Raised on a Yacht (w/ Vanessa Hill of BrainCraft!),Can I change my major if I have a scholarship?
192,192: Raised on a Yacht (w/ Vanessa Hill of BrainCraft!),Should there be compulsory voting?
192,192: Raised on a Yacht (w/ Vanessa Hill of BrainCraft!),How do I learn to ride a bike?
192,192: Raised on a Yacht (w/ Vanessa Hill of BrainCraft!),What is tipping etiquette in the US?
192,192: Raised on a Yacht (w/ Vanessa Hill of BrainCraft!),When is it my turn to watch TV?
192,192: Raised on a Yacht (w/ Vanessa Hill of BrainCraft!),Can I take a blanket covered with pictures of me to college?
192,192: Raised on a Yacht (w/ Vanessa Hill of BrainCraft!),Will the US claim Mars as a state?
192,192: Raised on a Yacht (w/ Vanessa Hill of BrainCraft!),How does boxed mac and cheese work?
193,193: It's Like a Pool of Liver!,Why do I cry more easily as I get older?
193,193: It's Like a Pool of Liver!,What is SPF?
193,193: It's Like a Pool of Liver!,What are healthy methods to combat loneliness?
193,193: It's Like a Pool of Liver!,What should I do if I busted a hole in the wall while bonding with my sibling?
193,193: It's Like a Pool of Liver!,How do I be less curt in texts and emails?
193,193: It's Like a Pool of Liver!,Where does John consume his hot takes?
193,193: It's Like a Pool of Liver!,How do I stop being bad at cooking?
193,193: It's Like a Pool of Liver!,How would John and Hank have met if they weren’t brothers?
193,193: It's Like a Pool of Liver!,How do I make this locker room my new home?
194,"194: Fortunately, They Are Not Carnivores",How do I advance past the waving stage of acquaintanceship?
194,"194: Fortunately, They Are Not Carnivores",What does one do at conferences?
194,"194: Fortunately, They Are Not Carnivores",My friend based a character off of me but the character sucks?
194,"194: Fortunately, They Are Not Carnivores",How do I get in my house if I'm locked out?
194,"194: Fortunately, They Are Not Carnivores",From where does a giant African land snail poop?
194,"194: Fortunately, They Are Not Carnivores",Can I have only one jacked arm?
195,195: Fun with Bob and John!,What should I do with all these keys?
195,195: Fun with Bob and John!,How do I unrecommend a raunchy novel to my grandma?
195,195: Fun with Bob and John!,What's a good psychology team name?
195,195: Fun with Bob and John!,What is the most effective way to pull an all-nighter?
195,195: Fun with Bob and John!,What should I call my girlfriend's parents?
195,195: Fun with Bob and John!,Why are middle schoolers so terrifying?
195,195: Fun with Bob and John!,What do I do with all these tomatoes?
196,196: There Is Nothing You Are Not,How did they decide doorbells should go ding dong?
196,196: There Is Nothing You Are Not,How do I get my coworkers out of my personal life?
196,196: There Is Nothing You Are Not,Why does Hank have button-up jeans?
196,196: There Is Nothing You Are Not,How do you not worry that everything you write has been written before?
196,196: There Is Nothing You Are Not,What are the odds that I'm part pigeon?
196,196: There Is Nothing You Are Not,Why don't you see tons of stars when you're in space?
197,197: It's All About Empowerment! (w/ Jenny Owen Youngs!),How do I promote myself?
197,197: It's All About Empowerment! (w/ Jenny Owen Youngs!),Are museums better explored individually or as a group?
197,197: It's All About Empowerment! (w/ Jenny Owen Youngs!),What should I do with memorabilia I don't intend to display?
197,197: It's All About Empowerment! (w/ Jenny Owen Youngs!),What do I do when someone's in my seat?
197,197: It's All About Empowerment! (w/ Jenny Owen Youngs!),How should Sincere sign off emails?
197,197: It's All About Empowerment! (w/ Jenny Owen Youngs!),Why do bugs die on their backs?
197,197: It's All About Empowerment! (w/ Jenny Owen Youngs!),How do we put less value in personality tests?
197,197: It's All About Empowerment! (w/ Jenny Owen Youngs!),Do mascots smile inside the suit when posing for pictures?
198,198: No Ticket Out,What's with birthday cake flavor?
198,198: No Ticket Out,How do we know where we are in space?
198,198: No Ticket Out,Are we the last generation of humans?
198,198: No Ticket Out,Is it safe to shower when the power is out?
198,198: No Ticket Out,Can I be a dyslexic nerdfighter?
198,198: No Ticket Out,What do I wear to a pirate-themed wedding?
198,198: No Ticket Out,What is the physics of window air conditioners?
198,198: No Ticket Out,How do I stop talking about things my friends don’t care about?
200,200: Only If You Got Enough Life Jackets,What is the setup for this joke?
200,200: Only If You Got Enough Life Jackets,What's with people waving from boats?
200,200: Only If You Got Enough Life Jackets,Why don't cartoons change their outfits?
200,200: Only If You Got Enough Life Jackets,How do I tell someone I’ll be back but not RIGHT back?
