Episode Number,Episode Title,Question
239,259: Infinite Bird,Do you think this will be over by the end of the year?
239,259: Infinite Bird,What would human pet food taste like?
239,259: Infinite Bird,Are birds pee-shy?
239,259: Infinite Bird,How do I convince my partner that alligators aren't that big a deal?
239,259: Infinite Bird,Can listening to music really loud really damage your hearing?
239,239: Does This Have Walnuts or Pecans?,How do I connect with my siblings?
239,239: Does This Have Walnuts or Pecans?,Why do some cereals falsely claim nuts?
239,239: Does This Have Walnuts or Pecans?,Is it okay to call a professor by their first name?
239,239: Does This Have Walnuts or Pecans?,Are coffee machines a kitchen necessity?
239,239: Does This Have Walnuts or Pecans?,How do I format a scholarship essay?
240,240: Mail Order Memes,How does the ozone layer relate to climate change?
240,240: Mail Order Memes,How can I communicate with my phoneless best friend?
240,240: Mail Order Memes,How many ants would it take to carry a human?
240,240: Mail Order Memes,Can I drink 4-year-old soda?
241,241: An Exhaustive & Exhausting Study,How do I wrangle a lot of crickets?
241,241: An Exhaustive & Exhausting Study,How do I spend less time looking at screens?
241,241: An Exhaustive & Exhausting Study,Is a paperback version of a new book worth the wait?
241,241: An Exhaustive & Exhausting Study,What do I keep having recurring dreams about Nicolas Cage being my uncle?
241,241: An Exhaustive & Exhausting Study,Can you sneeze underwater?
242,"242: I Was Dunking a Basketball (Live in Atlanta, GA!)",How do I show non-consumerist appreciation for my mom?
242,"242: I Was Dunking a Basketball (Live in Atlanta, GA!)",Is it better to be sticky or slippery?
242,"242: I Was Dunking a Basketball (Live in Atlanta, GA!)",What's your favorite chair?
242,"242: I Was Dunking a Basketball (Live in Atlanta, GA!)",How do you get used to living in the cold?
242,"242: I Was Dunking a Basketball (Live in Atlanta, GA!)",How do I deal with having an awkward screen name?
242,"242: I Was Dunking a Basketball (Live in Atlanta, GA!)",How often do books get rejected by publishers?
242,"242: I Was Dunking a Basketball (Live in Atlanta, GA!)",How do you have a moderate opinion?
242,"242: I Was Dunking a Basketball (Live in Atlanta, GA!)",What's the dumbest way you've ever been injured?
242,"242: I Was Dunking a Basketball (Live in Atlanta, GA!)",How do you fight for custody of a goldfish?
242,"242: I Was Dunking a Basketball (Live in Atlanta, GA!)",How do I become mayor?
242,"242: I Was Dunking a Basketball (Live in Atlanta, GA!)",How do I lie about how I met my best friend?
243,243: Either 8½ or 68 Million,How do I help my mom manage her depression?
243,243: Either 8½ or 68 Million,How do I address a professor who signs their emails with initials?
243,243: Either 8½ or 68 Million,What size boot is Italy?
243,243: Either 8½ or 68 Million,What is the most seen you've ever felt by a piece of fiction?
243,243: Either 8½ or 68 Million,What's the best song to secretly learn on guitar?
243,243: Either 8½ or 68 Million,Has being writers affected your view of authorial intent?
243,243: Either 8½ or 68 Million,How do I learn to love opera for the music instead of the attention?
243,243: Either 8½ or 68 Million,What does stadium size have to do with football quality?
244,244: screamingfrog.mp3,"What could be in an audio file labeled ""screaming frog""?"
244,244: screamingfrog.mp3,Do you write with timelines in mind?
244,244: screamingfrog.mp3,What do I do with my grandma's fruitcake?
244,244: screamingfrog.mp3,Where do I get a bunch of mosquitos?
244,244: screamingfrog.mp3,Do Americans just walk into people's houses like on TV?
244,244: screamingfrog.mp3,What's the deal with voting?
244,244: screamingfrog.mp3,Do magnets work in space?
244,244: screamingfrog.mp3,Can we tell if a planet disappeared?
245,245: We Are Held Together by Sunlight,What happens to viruses when they die?
245,245: We Are Held Together by Sunlight,Is it possible to separate the art from the artist?
245,245: We Are Held Together by Sunlight,Why did you guys talk about Al Gore so much in 2007?
245,245: We Are Held Together by Sunlight,How do you retrain your brain?
245,245: We Are Held Together by Sunlight,How do I feel confident in my abilities around older people?
245,245: We Are Held Together by Sunlight,"What is the statue of limitations for the term ""late""?"
245,245: We Are Held Together by Sunlight,What do I do with my new One Direction action figure set?
246,246: A Hard Wet Sponge,What are some socially distant birthday strategies?
246,246: A Hard Wet Sponge,Why do we refer to things as bone dry?
246,246: A Hard Wet Sponge,Do all microwaves rotate in the same direction?
246,246: A Hard Wet Sponge,Why haven't we cured cancer?
246,246: A Hard Wet Sponge,Can I appropriate abandoned office plants?
246,246: A Hard Wet Sponge,Is it okay to drink tea from a coffee mug?
246,246: A Hard Wet Sponge,Why does alphabetical order exist?
246,246: A Hard Wet Sponge,What does it mean to waste water?
247,247: Lobster Dream Hands,How do I learn to dance?
247,247: Lobster Dream Hands,Why do shirts have tags?
247,247: Lobster Dream Hands,Have you ever published a book under a pen name?
247,247: Lobster Dream Hands,Where did air quotes come from?
247,247: Lobster Dream Hands,How do you answer the phone at 2 AM?
247,247: Lobster Dream Hands,Should I be worried about entering the workforce if I don't like meetings?
247,247: Lobster Dream Hands,Why do you two use the same youtube account?
248,248: Nature's Solar Panels,How do you greet multiple friends in different time zones?
248,248: Nature's Solar Panels,What are some other card games that scratch the same itch as Uno?
248,248: Nature's Solar Panels,Could I swim in the water table like a lake?
248,248: Nature's Solar Panels,Can I photosynthesize like a plant?
248,248: Nature's Solar Panels,"If other animals didn't already fly, would we still have invented planes?"
248,248: Nature's Solar Panels,"When bugs land on us, is it because they think we're majestic?"
249,249: The Liverbird in the Room (Live at VidCon Now!),Any life advice for a recent college graduate?
249,249: The Liverbird in the Room (Live at VidCon Now!),"If you put milk in a bowl of croutons, is that dinner cereal?"
249,249: The Liverbird in the Room (Live at VidCon Now!),How do I stay motivated to create?
249,249: The Liverbird in the Room (Live at VidCon Now!),What have you learned about yourselves or each other lately?
249,249: The Liverbird in the Room (Live at VidCon Now!),What should I do for graduation cap decorations?
249,249: The Liverbird in the Room (Live at VidCon Now!),What would you like to do for a solo podcast?
249,249: The Liverbird in the Room (Live at VidCon Now!),How do create content while staying true to myself?
249,249: The Liverbird in the Room (Live at VidCon Now!),How do you fit 3 bedrooms into 2?
249,249: The Liverbird in the Room (Live at VidCon Now!),What was your favorite VidCon moment ever?
249,249: The Liverbird in the Room (Live at VidCon Now!),What flavor of ice cream should I make?
250,250: Carl Yastrzemski's Business School,How do I live the dream of not having a job?
250,250: Carl Yastrzemski's Business School,What's the history of mouth cleaning?
250,250: Carl Yastrzemski's Business School,Do authors get to choose the font of their books?
250,250: Carl Yastrzemski's Business School,Why are piggy banks shaped like pigs?
250,250: Carl Yastrzemski's Business School,How do you feel about sibling comparisons?
250,250: Carl Yastrzemski's Business School,How finite is the atmosphere?
251,251: 5 Seconds is 1 Mile,Where should I be during a phone interview?
251,251: 5 Seconds is 1 Mile,Do other animals get sick as often as humans do?
251,251: 5 Seconds is 1 Mile,What's the time/distance correlation between lightning and thunder?
251,251: 5 Seconds is 1 Mile,What's a rehearsal dinner?
251,251: 5 Seconds is 1 Mile,What do I do with really minor TikTok fame?
251,251: 5 Seconds is 1 Mile,What happens to amputated limbs?
251,251: 5 Seconds is 1 Mile,How do I make remote wedding guests feel included?
252,252: A Comedy Podcast About Chemical Equilibrium,How do I handle my fear of megacryometeors?
252,252: A Comedy Podcast About Chemical Equilibrium,Why do bugs like lights so much?
252,252: A Comedy Podcast About Chemical Equilibrium,Where is John's Edgar Allen Poe bust?
252,252: A Comedy Podcast About Chemical Equilibrium,How do I stay productive while recovering from surgery?
252,252: A Comedy Podcast About Chemical Equilibrium,Would fireworks work in space?
252,252: A Comedy Podcast About Chemical Equilibrium,How do you work All Star into your video titles?
253,253: Tensor Tympani Work With Me,How much paint does it take to make a room smaller?
253,253: Tensor Tympani Work With Me,Why can't we hear when we yawn?
253,253: Tensor Tympani Work With Me,Are we always expanding the same way the universe is?
253,253: Tensor Tympani Work With Me,Why does gatekeeping happen?
253,253: Tensor Tympani Work With Me,Why is there an L on a hill in Missoula?
254,254: It Ain't Easy Being Green Bunnies,How do eels reproduce?
254,254: It Ain't Easy Being Green Bunnies,Why isn't there green fur in nature?
254,254: It Ain't Easy Being Green Bunnies,Is small talk a betrayal?
254,254: It Ain't Easy Being Green Bunnies,Where do rights come from?
254,254: It Ain't Easy Being Green Bunnies,What do I do about a late birthday present?
254,254: It Ain't Easy Being Green Bunnies,What's the name of our solar system?
255,"255: Hello, Mr. & Mr. Green","What is ""other"" on my phone's storage?"
255,"255: Hello, Mr. & Mr. Green",How do I handle my life being thrown off track?
255,"255: Hello, Mr. & Mr. Green",What's the policy on renaming a fostered fish?
255,"255: Hello, Mr. & Mr. Green",Are mushrooms a vegetable?
255,"255: Hello, Mr. & Mr. Green",How do I smile from behind a mask?
255,"255: Hello, Mr. & Mr. Green",Can I run through people's sprinklers?
255,"255: Hello, Mr. & Mr. Green",How do I start a conversation with my roommate about enjoying your work?
255,"255: Hello, Mr. & Mr. Green",How do I navigate bookstore genres without consulting someone in person?
256,256: A Lonely Road (w/Jacob Goldstein!),What is money?
256,256: A Lonely Road (w/Jacob Goldstein!),"How do you not look suspicious when you find $60,000?"
256,256: A Lonely Road (w/Jacob Goldstein!),How do I tell my friend I'm uncomfortable hearing brag about their salary?
256,256: A Lonely Road (w/Jacob Goldstein!),What do I do now that I accidentally turned my boyfriend's sheets pink?
256,256: A Lonely Road (w/Jacob Goldstein!),How do you pick a car?
256,256: A Lonely Road (w/Jacob Goldstein!),How do I get comfortable calling myself a writer?
256,256: A Lonely Road (w/Jacob Goldstein!),How do I handle my friends throwing a birthday party for their dog on my birthday?
257,257: There Eye Am (w/ Taha Khan at VidCon London!),Why do different animals make such different noises?
257,257: There Eye Am (w/ Taha Khan at VidCon London!),What's the deal with Fahrenheit?
257,257: There Eye Am (w/ Taha Khan at VidCon London!),How do I not invite all my friends to a gathering?
257,257: There Eye Am (w/ Taha Khan at VidCon London!),Why is my hair darker when it's wet but not underwater?
257,257: There Eye Am (w/ Taha Khan at VidCon London!),Is snot me?
257,257: There Eye Am (w/ Taha Khan at VidCon London!),What do I do with a lot of starfruit?
258,258: A Really Old Cheetah,Will it be safe for my roommate's rabbit to be on TV next spring?
258,258: A Really Old Cheetah,What do I pack for an evacuation?
258,258: A Really Old Cheetah,Did people make paper planes before the Wright Brothers?
258,258: A Really Old Cheetah,What's the website you mentioned that had ballot information?
258,258: A Really Old Cheetah,Why don't we hear animals fart?
258,258: A Really Old Cheetah,How do I feel better about working at an oil company?
258,258: A Really Old Cheetah,Would giants be slow?
260,260: His One Loamy Weakness,Why do superheroes fly with their arms out in front?
260,260: His One Loamy Weakness,Were my college expectations way off?
260,260: His One Loamy Weakness,Could we use space travel to look at dinosaurs?
260,260: His One Loamy Weakness,Should I feel bad about moderating my comment sections?
260,260: His One Loamy Weakness,Why aren't shadows totally black?
261,261: Not Pastable,Why is fire shaped like fire?
261,261: Not Pastable,What Halloween costumes work with a mask?
261,261: Not Pastable,Why do dumpsters all smell the same?
261,261: Not Pastable,How do I stop getting voting ads now that I've decided to vote?
261,261: Not Pastable,Will humans someday run out of dirt?
261,261: Not Pastable,Who had the idea for keys?
261,261: Not Pastable,Can you cook pasta in something besides water?
261,261: Not Pastable,Is it a bad sign if no ads show up in an ad break?
262,"262: The Old Ramen Factory (Live in Carmel, IN!)",What's up with roundabouts?
262,"262: The Old Ramen Factory (Live in Carmel, IN!)",What should my former foster grandpa name be?
262,"262: The Old Ramen Factory (Live in Carmel, IN!)",What are your weirdest stress coping mechanisms?
262,"262: The Old Ramen Factory (Live in Carmel, IN!)",What's your absurd dream scent?
262,"262: The Old Ramen Factory (Live in Carmel, IN!)",What are your favourite non-touristy places in Indiana?
262,"262: The Old Ramen Factory (Live in Carmel, IN!)",What would happen if a werewolf went to the moon?
262,"262: The Old Ramen Factory (Live in Carmel, IN!)",How do I cope with taking extra time for college?
262,"262: The Old Ramen Factory (Live in Carmel, IN!)",What do I do for a disrupted honeymoon?
262,"262: The Old Ramen Factory (Live in Carmel, IN!)",What do I bring when moving to a new country?
262,"262: The Old Ramen Factory (Live in Carmel, IN!)",How can I get my partner and cat to get along?
263,263: Before the Acorns,Can you really fly close enough to the sun to melt wax wings?
263,263: Before the Acorns,Why does it take a minute for hot water to come out of the tap?
263,263: Before the Acorns,Where are non-binary people from?
263,263: Before the Acorns,Why shouldn't I eat grass?
263,263: Before the Acorns,Do Americans have to pay fire insurance?
263,263: Before the Acorns,What's topsoil?
264,264: The Opposite of a Trophy,Why were soda fountains a big deal?
264,264: The Opposite of a Trophy,Why don't holes in the ground below sea level always fill with water?
264,264: The Opposite of a Trophy,Why is pint pronounced the way it is?
265,265: The Kazoo Came First,How do I get better at communicating my feelings?
265,265: The Kazoo Came First,! Could the dinosaurs have seen the meteor on its way?
265,265: The Kazoo Came First,Was John really shocked by an electric pen in Crash Course?
266,"266: Doin' My Work, Jerk",What would happen if I found dinosaur bones in my backyard?
266,"266: Doin' My Work, Jerk",How do I reply to my boss's strange greeting?
266,"266: Doin' My Work, Jerk",Did people roll their eyes in the 1800s?
267,267: One From the Archives,How much sand can I take from the beach before it becomes immoral?
267,267: One From the Archives,Are there fossils in space?
267,267: One From the Archives,Where does a pirate accent come from?
268,268: How Onion Weight Per Onion,What do I do about a secret snake neighbor?
268,268: How Onion Weight Per Onion,What do I do with excessive root vegetables?
268,268: How Onion Weight Per Onion,How do I respond to someone asking if I'm blushing?
269,"269: Into the Future, Vittorio",How do I achieve my dream fridge?
269,"269: Into the Future, Vittorio",Why are cartoon mice cute?
269,"269: Into the Future, Vittorio",How does rounding up for charity work?
270,270: Frailty's Pickle,What do I do if I found my Christmas presents?
270,270: Frailty's Pickle,How do I ensure my friend gets my dead hand?
270,270: Frailty's Pickle,"Where does the phrase ""in a pickle"" come from?"
271,271: The Best Pant (Live at VidCon London w/Hannah Witton!),How do I make new friends?
271,271: The Best Pant (Live at VidCon London w/Hannah Witton!),What do I do while someone is saying hi to my dog?
271,271: The Best Pant (Live at VidCon London w/Hannah Witton!),Will people of the future have inaccurate fairs about us?
272,272: If It Was A Good Moose,Are Medusa's powers affected by beauty's subjectivity?
272,272: If It Was A Good Moose,What are some surprisingly edible things?
272,272: If It Was A Good Moose,How do I pet a moose?
273,273: John's Shark Bite,What is John's emergency scale?
273,273: John's Shark Bite,When do you list someone other than immediate family as an emergency contact?
273,273: John's Shark Bite,Can planets be other shapes?
274,274: Not and Never Both,Is Benjamin Harrison the exact middle president of the USA?
274,274: Not and Never Both,Would a younger version of me be able to open my phone?
274,274: Not and Never Both,When did we start counting minutes and seconds?
275,275: What Good Death Quotes,What is the most common name in human history?
275,275: What Good Death Quotes,What's up with epigraphs in books?
275,275: What Good Death Quotes,When does researching become spying?
276,276: An Onomatopoetic Wifi Explainer,Is it rude to turn off the lights while my dog eats?
276,276: An Onomatopoetic Wifi Explainer,How does wifi work?
276,276: An Onomatopoetic Wifi Explainer,Why do cans explode in the cold but not bottles?
277,277: One Quirk Too Many,Why do American weeks start on Sunday?
277,277: One Quirk Too Many,How long should Christmas decorations stay up?
277,277: One Quirk Too Many,How do I add novelty to my life?
278,278: Popeulation Density,Can a whale use a snorkel?
278,278: Popeulation Density,How many popes per square mile does the Vatican have?
278,278: Popeulation Density,Is artificial gravity possible?
279,279: Live Your Whimsy (w/Farah Alibay!),How will humans keep track of days on Mars?
279,279: Live Your Whimsy (w/Farah Alibay!),How do I stop imagining mice in books?
279,279: Live Your Whimsy (w/Farah Alibay!),What's it like being a systems engineer for the Perseverance Rover?
280,280: Music in the Wind (w/ Katherine Green!),How many songs go on a perfect playlist?
280,280: Music in the Wind (w/ Katherine Green!),Why don't eyes fog up like glasses?
280,280: Music in the Wind (w/ Katherine Green!),How do I track down a mystery smell?
281,281: Reverse Photon Farts,Would Earth bounce if you shrank it?
281,281: Reverse Photon Farts,How do pupils dilate?
281,281: Reverse Photon Farts,What is tape made of?
282,282: The Silly Brothers,Who writes author bios in the back of books?
282,282: The Silly Brothers,Why do things burn up when entering the atmosphere but not exiting it?
282,282: The Silly Brothers,Can you make a cake?
283,283: Nightmare Antz (w/ Ashley C. Ford!),How do I tell my mom her breath is bad?
283,283: Nightmare Antz (w/ Ashley C. Ford!),Was it okay to email my doctor?
283,283: Nightmare Antz (w/ Ashley C. Ford!),Can a fetus yawn?
284,284: Brain Secretions Worthy of Consumption (w/ Charlie Jane Anders!),How do we know if our ideas are original?
284,284: Brain Secretions Worthy of Consumption (w/ Charlie Jane Anders!),Are there any serious efforts to colonize asteroids?
284,284: Brain Secretions Worthy of Consumption (w/ Charlie Jane Anders!),What unnecessary things do you do to make life more enjoyable?
285,285: A Pill Meant for Horses,Is it okay to ask people for their discarded tree branches?
285,285: A Pill Meant for Horses,How long should the vaccine need to be in my system before a whale can eat my arm?
285,285: A Pill Meant for Horses,How do they get all that medicine in such a small pill?
286,286: A Number Likely to Go Up,When should I get a vase?
286,286: A Number Likely to Go Up,What happens when a cemetery goes bankrupt?
286,286: A Number Likely to Go Up,Why aren't there spicy animals?
287,287: The AFC Wimbledon & Mars Spectacular,What happened on Mars this week?
287,287: The AFC Wimbledon & Mars Spectacular,What's AFC Wimbledon up to?
288,288: I Thought I'd Come Up With A Joke,What did we do before glasses?
288,288: I Thought I'd Come Up With A Joke,What do I do about freeloading roommates?
288,288: I Thought I'd Come Up With A Joke,Where are all the Irish setters?
289,289: No Moon Chickens,Why are crisp packet wrappers so noisy?
289,289: No Moon Chickens,What's between your organs?
289,289: No Moon Chickens,Are Martian sunsets really blue?
290,290: Independent Elmer Experts,Which side of the bagel is better?
290,290: Independent Elmer Experts,Who decides when Easter happens?
290,290: Independent Elmer Experts,"Who decides anything, really?"
290,290: Independent Elmer Experts,Is it normal to sneeze?
291,291: The Dear Hank Letter,Is the crust the healthiest part of bread?
291,291: The Dear Hank Letter,What would a Dear Hank letter be?
291,291: The Dear Hank Letter,Am I allergic to Mars?
292,292: AlienzBop,What are mausoleums for?
292,292: AlienzBop,What's the best gift for aliens?
292,292: AlienzBop,"Who coined the phrase ""coined a phrase""?"
293,293: A Fiction of Light,When do you change the hair color on your ID?
293,293: A Fiction of Light,Why is Venus hotter than Mercury?
293,293: A Fiction of Light,What do I do with peed-on lettuce?
294,"294: We Messed Up, So Let's Talk Crash Course!",How can I support the creation of free educational content?
295,295: Have I Got Some Roaches For You,Can your tongue get swole?
295,295: Have I Got Some Roaches For You,Why do we call dog arms legs?
295,295: Have I Got Some Roaches For You,What would an inconvenience store sell?
296,296: The Y'all Call,How do I avoid grieving the living?
296,296: The Y'all Call,Can a box be round or oval?
296,296: The Y'all Call,How do you keep one perfect book from ruining all others for you?
297,297: The Mariko Aoki Brothers,Why do some books tell you what font they use?
297,297: The Mariko Aoki Brothers,What's up with temporary moons?
297,297: The Mariko Aoki Brothers,Why do book stores smell like book stores?
298,298: The Whens and Wheres of Thens and Theres (w/Jess Zafarris!),"Why can you answer what, when, and where with that, then, and there?"
299,299: A Very Dark Place Inside My Bones,How do I figure out when a wedding is being held?
299,299: A Very Dark Place Inside My Bones,How do bees work?
299,299: A Very Dark Place Inside My Bones,Does sunlight hit my bones?
300,300: Robocalling Ryans,What's the easiest way to look like you're working?
300,300: Robocalling Ryans,What is storm oil?
300,300: Robocalling Ryans,When do I have to start answering calls from numbers I don't know?
301,301: Super Humble Spy Brothers,Why do people say good things humble them?
301,301: Super Humble Spy Brothers,How do I work at a sandwich shop?
301,301: Super Humble Spy Brothers,What is a homeroom?
302,"302: Please, Your Reimbursement Here",What's less scared of us than we are of it?
302,"302: Please, Your Reimbursement Here",Why do spammers call me Cameron?
302,"302: Please, Your Reimbursement Here",How do I reply to a friend with a tenuous grasp Can my glasses burn my eyes like a magnifying glass?
303,303: Come Back With A Warrant,How much does a rainbow weigh?
303,303: Come Back With A Warrant,Where is Voyager headed?
303,303: Come Back With A Warrant,"What does ""not unkindly"" mean?"
304,304: Snotty Little Crapburger,How do I bail on a high school I never attended?
304,304: Snotty Little Crapburger,Should I attend my high school's do-over prom?
304,304: Snotty Little Crapburger,How does gravity affect lemon men?
305,305: No Manholes Allowed,How fast to you have to be to follow the sunset?
305,305: No Manholes Allowed,Should a three-headed dog have three names?
305,305: No Manholes Allowed,Why do car speedometers go so high?
306,306: Lemon People Bucket Problem,What is indigo?
306,306: Lemon People Bucket Problem,Would we notice if everything in the universe got bigger?
306,306: Lemon People Bucket Problem,"If I fell through a cloud, would I get wet?"
307,307: Snizza John,What can a license plate tell you?
307,307: Snizza John,Which person is the piggy in the piggy back ride?
307,307: Snizza John,Can non-cherry fruits be maraschinoed?
308,308: No More Dongles,Wouldn't it be easier to genetically engineer a martian than terraform Mars?
308,308: No More Dongles,How do mirrors represent distance?
308,308: No More Dongles,Should I wear my Pizza John mask to jury duty?
309,309: The Modern Pacifier,How do I be less dependent on my phone?
309,309: The Modern Pacifier,What happens if you eat the scoby?
309,309: The Modern Pacifier,Where did museums come from?
310,310: Ruined Rax Pants,Who decided what pen colors were professional?
310,310: Ruined Rax Pants,Do you have any advice for stage fright?
310,310: Ruined Rax Pants,"If you dropped something in a hole drilled all the way through earth, where would it end up?"
311,311: Confurious (w/ Deboki Chakravarti!),Could we clone a neanderthal today?
311,311: Confurious (w/ Deboki Chakravarti!),Would I get sick if I ate the Mona Lisa?
311,311: Confurious (w/ Deboki Chakravarti!),What is the skin of your teeth?
312,312: Chonkadees,What luggage should I buy?
312,312: Chonkadees,How do I arrange to be fossilized after my death?
312,312: Chonkadees,How do we know the universe is expanding?
313,313: I Will Not Engage,Why are American English classes so intent on finding meaning?
313,313: I Will Not Engage,How would sound work through Gabriel's Horn?
313,313: I Will Not Engage,Does nobody really like you when you're 23?
314,314: The Ultimate Week in Ryans (w/Ryan Reynolds!),Can I return to a coffee shop if I forgot sugar and cream?
