Episode Number,Episode Title,Question
200,200: Only If You Got Enough Life Jackets,What is your self-care routine?
200,200: Only If You Got Enough Life Jackets,How do I follow soccer?
200,200: Only If You Got Enough Life Jackets,Where are all the Bob Ross paintings?
200,200: Only If You Got Enough Life Jackets,Why are flies?
200,200: Only If You Got Enough Life Jackets,?
201,201: Giant Stone Abraham Lincoln 2020,Can a sentient statue run for president?
201,201: Giant Stone Abraham Lincoln 2020,How do I attend a show solo?
201,201: Giant Stone Abraham Lincoln 2020,How can I be bougie enough for art frames?
201,201: Giant Stone Abraham Lincoln 2020,Could Elsa solve climate change?
201,201: Giant Stone Abraham Lincoln 2020,How can I not be a sobbing mess on my wedding day?
201,201: Giant Stone Abraham Lincoln 2020,Should I make a new ring for my dad?
201,201: Giant Stone Abraham Lincoln 2020,What should I do when I'm not sure if I know someone?
202,202: Pants Clone,Where are the natural wheels?
202,202: Pants Clone,How do I make a conspiracy theorist understand that space exists?
202,202: Pants Clone,What are SEO tools?
202,202: Pants Clone,Should we market climate change better?
202,202: Pants Clone,Why are car horns so primitive?
202,202: Pants Clone,How do I confront my mortality compared to red curry paste?
202,202: Pants Clone,What do I do about the frog in the car?
202,202: Pants Clone,Are Tic Tacs food?
203,"203: Joy, Attention, Justice, Hips Don't Lie",What do I do with 15 pounds of cornbread?
203,"203: Joy, Attention, Justice, Hips Don't Lie",Where do song lyrics live in our brains?
203,"203: Joy, Attention, Justice, Hips Don't Lie",Why are we here?
203,"203: Joy, Attention, Justice, Hips Don't Lie",How did people get answers before Google?
203,"203: Joy, Attention, Justice, Hips Don't Lie",How often should I vacuum?
203,"203: Joy, Attention, Justice, Hips Don't Lie",Do wedding pianists get anxious?
203,"203: Joy, Attention, Justice, Hips Don't Lie",When are my vegetable plants ready?
203,"203: Joy, Attention, Justice, Hips Don't Lie",Can I skip the parts about farming in Anna Karenina?
204,"204: Quiet, Subdued, and Possibly Illicit",How do I make this flesh-eating bacteria sound safe?
204,"204: Quiet, Subdued, and Possibly Illicit",How do I tell my housemate not to get a crockpot?
204,"204: Quiet, Subdued, and Possibly Illicit",Am I as unlikeable as the character I wrote?
204,"204: Quiet, Subdued, and Possibly Illicit",Does my friend live with a ghost?
204,"204: Quiet, Subdued, and Possibly Illicit",How did conspiracy theories spread before the internet?
204,"204: Quiet, Subdued, and Possibly Illicit",Why are the most-viewed vlogbrothers videos about giraffe sex?
204,"204: Quiet, Subdued, and Possibly Illicit",How do I stop my favorite movie from being my whole personality?
204,"204: Quiet, Subdued, and Possibly Illicit",How would fandoms respond to the apocalypse?
205,205: Piggy Bank Toughness,Should I call this strange number back?
205,205: Piggy Bank Toughness,What have I missed on the pod?
205,205: Piggy Bank Toughness,Why are your faves your faves?
205,205: Piggy Bank Toughness,Don't you need more than lemons for lemonade?
205,205: Piggy Bank Toughness,How do I get the money out of this coin bank?
205,205: Piggy Bank Toughness,Should I get bangs?
205,205: Piggy Bank Toughness,Should I change my email address?
205,205: Piggy Bank Toughness,Why do I get the urge to get my life together in the middle of the night?
205,205: Piggy Bank Toughness,How do I make time pass in my stories?
205,205: Piggy Bank Toughness,What is with that baseball song?
206,206: If You Can't Put Your Mouth There... (with Andrew Levitt AKA Nina West!),How should I act around my professor who is also my peer?
206,206: If You Can't Put Your Mouth There... (with Andrew Levitt AKA Nina West!),Do the knobs on toasters control heat or time?
206,206: If You Can't Put Your Mouth There... (with Andrew Levitt AKA Nina West!),How do I not get matching tattoos with my mom?
206,206: If You Can't Put Your Mouth There... (with Andrew Levitt AKA Nina West!),Do you ever think about where all your hair is in the world?
206,206: If You Can't Put Your Mouth There... (with Andrew Levitt AKA Nina West!),How can I be less judgmental?
206,206: If You Can't Put Your Mouth There... (with Andrew Levitt AKA Nina West!),How should you display a sugar packet collection?
206,206: If You Can't Put Your Mouth There... (with Andrew Levitt AKA Nina West!),How do I tell people who think I'm dead that I'm not dead?
206,206: If You Can't Put Your Mouth There... (with Andrew Levitt AKA Nina West!),What should I do when I ring the doorbell and I'm not sure if I rang the doorbell?
206,206: If You Can't Put Your Mouth There... (with Andrew Levitt AKA Nina West!),How should you respond to neck skin compliments?
206,206: If You Can't Put Your Mouth There... (with Andrew Levitt AKA Nina West!),Are my new friends friends?
207,207: The Still Escalators of Doom,Why are unmoving escalators so disconcerting?
207,207: The Still Escalators of Doom,What do I do about the plant that died while I was house sitting?
207,207: The Still Escalators of Doom,What should I tell people who think I'm moving to the worst place in the world?
207,207: The Still Escalators of Doom,Should I tell my mom you're still alive?
207,207: The Still Escalators of Doom,What condiment would your body dispense?
207,207: The Still Escalators of Doom,How does iambic pentameter work?
207,207: The Still Escalators of Doom,How do we know when we're deriving too much from art?
207,207: The Still Escalators of Doom,How do I make friends in junior high?
207,207: The Still Escalators of Doom,How do I talk my brother out of aspiring to be a YouTube star?
208,"208: Speedo Minotaur Guy (Live from Madison, WI!)",Why is my instinct to hug my dogs too hard?
208,"208: Speedo Minotaur Guy (Live from Madison, WI!)","If you had to move to Sesame Street, who would you want to be your neighbor?"
208,"208: Speedo Minotaur Guy (Live from Madison, WI!)",How do you know when the story you've written is done?
208,"208: Speedo Minotaur Guy (Live from Madison, WI!)",Why was Halley's Comet selected for The Anthropocene Reviewed?
208,"208: Speedo Minotaur Guy (Live from Madison, WI!)",How does one properly celebrate the removal of orthodontia?
208,"208: Speedo Minotaur Guy (Live from Madison, WI!)",Am I causing defective elevators?
208,"208: Speedo Minotaur Guy (Live from Madison, WI!)",What do I do if my boyfriend is the speedo guy?
208,"208: Speedo Minotaur Guy (Live from Madison, WI!)",Is it okay if I wear my wedding band before I get married?
209,"209: Sword Dabbing (Live from Minneapolis, MN!)",How should I invest to survive a financial downturn?
209,"209: Sword Dabbing (Live from Minneapolis, MN!)",How often do I really need to change my underwear?
209,"209: Sword Dabbing (Live from Minneapolis, MN!)",Am I a bag?
209,"209: Sword Dabbing (Live from Minneapolis, MN!)",How do help seventh graders?
209,"209: Sword Dabbing (Live from Minneapolis, MN!)",Should we think about the 2D world?
209,"209: Sword Dabbing (Live from Minneapolis, MN!)",What are wedding planning tips?
209,"209: Sword Dabbing (Live from Minneapolis, MN!)",How do I stop imitating accents?
209,"209: Sword Dabbing (Live from Minneapolis, MN!)",How do I deal with the ghosts?
209,"209: Sword Dabbing (Live from Minneapolis, MN!)",How do I innovate in a sword company?
210,210: Chest Moose Tattoo (w/ SciShow Tangents!),What's going on with microbes?
210,210: Chest Moose Tattoo (w/ SciShow Tangents!),What happens when an astronaut sneezes in space?
210,210: Chest Moose Tattoo (w/ SciShow Tangents!),Why do we have toes?
210,210: Chest Moose Tattoo (w/ SciShow Tangents!),Should I dress fancier?
210,210: Chest Moose Tattoo (w/ SciShow Tangents!),Why aren’t there drones on Mars?
210,210: Chest Moose Tattoo (w/ SciShow Tangents!),Do you get lighter every time you fart?
210,210: Chest Moose Tattoo (w/ SciShow Tangents!),What do I do about the poster I don’t understand?
210,210: Chest Moose Tattoo (w/ SciShow Tangents!),Why do animals live for different amounts of time?
211,"211: You Can Tik Whatever You Can Tok, Baby (Live from VidCon Australia w/ Zach Kornfeld!)",What is the least dumb way to ask someone out?
211,"211: You Can Tik Whatever You Can Tok, Baby (Live from VidCon Australia w/ Zach Kornfeld!)",What’s your strategy for winning Seven Wonders?
211,"211: You Can Tik Whatever You Can Tok, Baby (Live from VidCon Australia w/ Zach Kornfeld!)",How did you start from nothing?
211,"211: You Can Tik Whatever You Can Tok, Baby (Live from VidCon Australia w/ Zach Kornfeld!)",If you can portray any celebrity in a biopic who would it be?
211,"211: You Can Tik Whatever You Can Tok, Baby (Live from VidCon Australia w/ Zach Kornfeld!)",Would you consider becoming a TikTok star?
211,"211: You Can Tik Whatever You Can Tok, Baby (Live from VidCon Australia w/ Zach Kornfeld!)",Why do birds?
212,212: The Billionaire Cactus Ghost,What can I do with my cactus costume?
212,212: The Billionaire Cactus Ghost,What do you do when people you don't know recognize you?
212,212: The Billionaire Cactus Ghost,Why are all the ghosts so old?
212,212: The Billionaire Cactus Ghost,Where do grownups keep their potatoes?
212,212: The Billionaire Cactus Ghost,Are there ghosts on Mars?
212,212: The Billionaire Cactus Ghost,How do I make my career choice not sound boring?
212,212: The Billionaire Cactus Ghost,Is climate change for real?
213,213: Baddy One Shoe,Why don't we sink in sand?
213,213: Baddy One Shoe,How do I not freak out about all the time I'm wasting?
213,213: Baddy One Shoe,Do naughty people only wear one shoe?
213,213: Baddy One Shoe,Why do microwaves rotate food?
213,213: Baddy One Shoe,Am I up or down for whatever?
213,213: Baddy One Shoe,My boyfriend doesn't know who Elon Musk is?
213,213: Baddy One Shoe,What would happen if we immediately halted single-use plastics?
214,214: Crime Dentures,How do I make a film for dental school?
214,214: Crime Dentures,What if my anglerfish doesn’t match my room decor?
214,214: Crime Dentures,What should I do with a bag full of 1500 pictures of pregnant Harry Styles?
214,214: Crime Dentures,Do I need to talk to my boss about the book they lent me?
214,214: Crime Dentures,Can I zest a bit of lime at the store?
214,214: Crime Dentures,Any podcast recommendations?
214,214: Crime Dentures,What song should I blast through the church steeple?
215,215: The Big Card,Is it acceptable to put sugar on cottage cheese?
215,215: The Big Card,Can a Ravenclaw wear Slytherin merch?
215,215: The Big Card,How do I stop stressing about stress?
215,215: The Big Card,How do we know what's at the center of the Earth?
215,215: The Big Card,Should British people get a constitution?
215,215: The Big Card,Why don't snow globes get moldy inside?
215,215: The Big Card,Why do grocery stores have olive bars?
215,215: The Big Card,Should I ask why I wasn't invited to a wedding?
216,216: Zombie Turtle Party,Why do we say “head over heels”?
216,216: Zombie Turtle Party,What should I wear to a Mountain Goats concert?
216,216: Zombie Turtle Party,What is the best thing that happened during the 2010s?
216,216: Zombie Turtle Party,Do airplanes have horns?
216,216: Zombie Turtle Party,What is my boyfriend’s interesting news?
216,216: Zombie Turtle Party,?
216,216: Zombie Turtle Party,How much money would I need to donate to PIH to get you to go bungee jumping or skydiving?
216,216: Zombie Turtle Party,What should I bring to a zombie turtle party besides a shovel?
216,216: Zombie Turtle Party,Justice or mercy?
216,216: Zombie Turtle Party,What happened to the short poems?
217,217: Rocks to Earth 2028!,Can stinging insects sting other insects?
217,217: Rocks to Earth 2028!,What is the scientific difference between stuffy and fresh air?
217,217: Rocks to Earth 2028!,Why aren't there many books about twenty-somethings?
217,217: Rocks to Earth 2028!,When did limos become uncool?
217,217: Rocks to Earth 2028!,How do I survive as the fifth wheel at Disney World?
217,217: Rocks to Earth 2028!,How do we know no two snowflakes are alike?
217,217: Rocks to Earth 2028!,What do you do on a bus with 51 twelve-year-olds?
218,218: Hank & John's Airport Stories,Why shouldn't I take my temperature after I eat?
218,218: Hank & John's Airport Stories,Will my fingerprint grow back?
218,218: Hank & John's Airport Stories,How will COPPA affect Crash Course?
218,218: Hank & John's Airport Stories,Can my bottle of frozen water get through TSA?
218,218: Hank & John's Airport Stories,At what age are you supposed to use the money in your piggy bank?
218,218: Hank & John's Airport Stories,What are the noises that landlines make when you dial a number?
218,218: Hank & John's Airport Stories,Could Bill Gates cure cancer?
218,218: Hank & John's Airport Stories,Will stickers be our civilization's cave art?
219,219: How to Become Part Crow,What is the proper reaction to a canceled Shawn Mendes concert?
219,219: How to Become Part Crow,When should I wear my fancy diamond gold pretzel necklace?
219,219: How to Become Part Crow,What am I supposed to do with the urn my dog's ashes were in?
219,219: How to Become Part Crow,Why do hamsters like wheels?
219,219: How to Become Part Crow,Why are there so few new Christmas songs?
219,219: How to Become Part Crow,Could I get a blood transplant from a crow?
219,219: How to Become Part Crow,Why don't we talk about the moon during the day?
220,220: Haunted Christmas Trees,Is it okay to go to your old house and ask if you can walk through it?
220,220: Haunted Christmas Trees,How do you research?
220,220: Haunted Christmas Trees,How do you interject in conversations smoothly?
220,220: Haunted Christmas Trees,Can you unpickle a pickle?
220,220: Haunted Christmas Trees,What should my rice crispy sculpture be?
220,220: Haunted Christmas Trees,Can I enjoy religious music as an atheist?
220,220: Haunted Christmas Trees,How do you sell yourself?
220,220: Haunted Christmas Trees,Will this tree haunt us?
222,222: Just a Man Who’s Lost His Dongle,What should I do with my art money?
222,222: Just a Man Who’s Lost His Dongle,What do you do if you miss a flight?
222,222: Just a Man Who’s Lost His Dongle,Are gas giants just tiny planets with big atmospheres?
222,222: Just a Man Who’s Lost His Dongle,Why does my brain release endorphins for things that are bad for me?
222,222: Just a Man Who’s Lost His Dongle,What should we do with the bird in the freezer?
223,223: All at Once for Everyone,What hobbies should I take up while my feet are broken?
223,223: All at Once for Everyone,What would you like to come back as in your next life?
223,223: All at Once for Everyone,"Am I ""just a teacher""?"
223,223: All at Once for Everyone,What is the proper response to a cheese burglar?
223,223: All at Once for Everyone,What should I do about the snoring guy?
223,223: All at Once for Everyone,Is there an American seasoning?
223,223: All at Once for Everyone,How long should you keep Christmas cards?
223,223: All at Once for Everyone,How do you deal with reliving a horrible moment over and over again?
223,223: All at Once for Everyone,Why does my daughter keep asking if I'm hungry?
223,223: All at Once for Everyone,What is proper puzzle protocol?
224,224: The Octopuscene,What happens to balloons when they fly away into the sky?
224,224: The Octopuscene,How do I record a video of myself?
224,224: The Octopuscene,Who should you thank?
224,224: The Octopuscene,Can bees feel happy and sad?
224,224: The Octopuscene,When does the Anthropocene end?
224,224: The Octopuscene,How do I get my boyfriend to take ghost travel seriously?
224,224: The Octopuscene,What does Kindle highlighting say about humanity?
225,"225: It’s a Hit and They Get Kicked (Live From St. Petersburg, FL!)",How can I find time to do all the things?
225,"225: It’s a Hit and They Get Kicked (Live From St. Petersburg, FL!)","If I smack someone with my lower limb prosthetic, am I kicking them?"
225,"225: It’s a Hit and They Get Kicked (Live From St. Petersburg, FL!)",What is the oddest combination of food you’ve seen someone eating?
225,"225: It’s a Hit and They Get Kicked (Live From St. Petersburg, FL!)",What if I love something everyone hates?
225,"225: It’s a Hit and They Get Kicked (Live From St. Petersburg, FL!)",Did you ever consider throwing in the towel?
225,"225: It’s a Hit and They Get Kicked (Live From St. Petersburg, FL!)",When do you figure out how to solve adult problems?
225,"225: It’s a Hit and They Get Kicked (Live From St. Petersburg, FL!)",What do I do about my leg’s fart sounds?
225,"225: It’s a Hit and They Get Kicked (Live From St. Petersburg, FL!)",How can I appear older in a room full of high school students?
225,"225: It’s a Hit and They Get Kicked (Live From St. Petersburg, FL!)",How do I convince my spouse to move for my improv group?
226,226: It Is the Monkey,How close is the sky to the ground?
226,226: It Is the Monkey,How do you keep the words that captivate you from slipping away?
226,226: It Is the Monkey,Is it okay to have doubts on the day of your wedding?
226,226: It Is the Monkey,Could I keep my spouse's calcified heart on my desk?
226,226: It Is the Monkey,What do I do if I'm trapped in a car due to skunk?
226,226: It Is the Monkey,"How do I properly use the phrase ""It's all downhill/uphill from here""?"
227,227: One-Star Statue Reviews,Where do I start with Star Trek?
227,227: One-Star Statue Reviews,Where does water go when I turn the faucet off?
227,227: One-Star Statue Reviews,Why does my nose produce more snot when I cry?
227,227: One-Star Statue Reviews,Should I ask permission before I sharpen my roommate's knives?
227,227: One-Star Statue Reviews,How do I become less emotionally attached to a statue I don't own?
227,227: One-Star Statue Reviews,Is it okay to wear white to a bride-less wedding reception?
227,227: One-Star Statue Reviews,Is there a way to use social media without getting drawn into arguments?
228,"228: You Say Banana, I Say Banana (w/ Rosianna Halse Rojas!)",How do I cope with my unrequited love for Timothée Chalamet?
228,"228: You Say Banana, I Say Banana (w/ Rosianna Halse Rojas!)",Why have I started exclusively reading non-fiction?
228,"228: You Say Banana, I Say Banana (w/ Rosianna Halse Rojas!)",How can I both support and express concern for my mom's world-class Candy Crush skills?
228,"228: You Say Banana, I Say Banana (w/ Rosianna Halse Rojas!)",What's the expiration date on a frozen turkey?
228,"228: You Say Banana, I Say Banana (w/ Rosianna Halse Rojas!)",How can I tell if my fiancée thinks my grandma starred in The Sound of Music?
228,"228: You Say Banana, I Say Banana (w/ Rosianna Halse Rojas!)",How do I keep a journal?
228,"228: You Say Banana, I Say Banana (w/ Rosianna Halse Rojas!)",How do I entertain myself without looking at a screen?
228,"228: You Say Banana, I Say Banana (w/ Rosianna Halse Rojas!)",How do I feel better about accidentally growing the wrong plants?
229,229: You Don't Know When the Sickness Is Coming (w/ Sarah Urist Green!),Should I go to a concert if my recent ex will be there?
229,229: You Don't Know When the Sickness Is Coming (w/ Sarah Urist Green!),How do book blurbs work?
229,229: You Don't Know When the Sickness Is Coming (w/ Sarah Urist Green!),Can a two-person book club even function?
229,229: You Don't Know When the Sickness Is Coming (w/ Sarah Urist Green!),How do I become a better writer?
229,229: You Don't Know When the Sickness Is Coming (w/ Sarah Urist Green!),How do I entertain myself while stuck in a department store?
229,229: You Don't Know When the Sickness Is Coming (w/ Sarah Urist Green!),Should I feel guilty about making less money than my partner?
229,229: You Don't Know When the Sickness Is Coming (w/ Sarah Urist Green!),How do I help my parents understand that Amsterdam is safe?
230,230: The Hot Love of Angry Pigeons,How do I stop losing forks?
230,230: The Hot Love of Angry Pigeons,How do I handle my cat's internet fame?
230,230: The Hot Love of Angry Pigeons,What's your favorite bird?
230,230: The Hot Love of Angry Pigeons,How do I quit my job?
230,230: The Hot Love of Angry Pigeons,What do I do when my job runs out of pasta?
230,230: The Hot Love of Angry Pigeons,Why do some chairs have butt grooves?
231,"231: Bouquet Trebuchet (Live in Raleigh, NC!)",Have you ever added a strange fact to a book?
231,"231: Bouquet Trebuchet (Live in Raleigh, NC!)",How does a teacher inspire their students?
231,"231: Bouquet Trebuchet (Live in Raleigh, NC!)",How do I figure out if NASA has aliens?
231,"231: Bouquet Trebuchet (Live in Raleigh, NC!)",Do lobsters feel pain?
231,"231: Bouquet Trebuchet (Live in Raleigh, NC!)",How do I focus on one book at a time?
231,"231: Bouquet Trebuchet (Live in Raleigh, NC!)",How do I keep my family from bringing a siege engine to my wedding?
231,"231: Bouquet Trebuchet (Live in Raleigh, NC!)",How do I tell someone my name without embarrassing them for getting it wrong?
231,"231: Bouquet Trebuchet (Live in Raleigh, NC!)",Is only ever wearing one color attractive?
231,"231: Bouquet Trebuchet (Live in Raleigh, NC!)",How do I get to know my new city?
231,"231: Bouquet Trebuchet (Live in Raleigh, NC!)",Is being in a spoon cult an interesting enough fact when I introduce myself?
232,232: The Construction Paper Diploma,How do I entertain myself during a quarantine?
232,232: The Construction Paper Diploma,Where is the center of the universe?
232,232: The Construction Paper Diploma,Why are the letters on a phone keypad upside down from a keyboard numberpad?
232,232: The Construction Paper Diploma,Should I stop talking to my friend because they don't like The Mountain Goats?
232,232: The Construction Paper Diploma,How do I cope with sudden major life changes?
233,233: The Adventures of Yukon John and Glass Foot Hank (w/ Dr. Aaron Carroll!),How do I convince my parents to take social isolation seriously?
233,233: The Adventures of Yukon John and Glass Foot Hank (w/ Dr. Aaron Carroll!),Can I social distance from the same room?
233,233: The Adventures of Yukon John and Glass Foot Hank (w/ Dr. Aaron Carroll!),How can I get to know my new town while social distancing?
233,233: The Adventures of Yukon John and Glass Foot Hank (w/ Dr. Aaron Carroll!),Are squirrels real?
233,233: The Adventures of Yukon John and Glass Foot Hank (w/ Dr. Aaron Carroll!),Should I tell my parents about the secret passage I found in my room?
233,233: The Adventures of Yukon John and Glass Foot Hank (w/ Dr. Aaron Carroll!),Whatever happened to Soggy Pitch?
234,"234: I Know About Drowsy, Too, Buddy",Are the astronauts stuck on the space station right now?
234,"234: I Know About Drowsy, Too, Buddy",What crafts or books can I use to pass the time?
234,"234: I Know About Drowsy, Too, Buddy",Will books still come out on schedule?
234,"234: I Know About Drowsy, Too, Buddy",How do I paint something other than animals in dresses?
234,"234: I Know About Drowsy, Too, Buddy","What does ""under the weather"" mean?"
234,"234: I Know About Drowsy, Too, Buddy",Do chickens go through menopause?
234,"234: I Know About Drowsy, Too, Buddy",What's the best human law for a cat to break?
234,"234: I Know About Drowsy, Too, Buddy",Can you make your website less confusing?
234,"234: I Know About Drowsy, Too, Buddy",Why does rubbing alcohol evaporate?
234,"234: I Know About Drowsy, Too, Buddy",How do I stay positive while on the front lines of a pandemic?
235,235: Do Duck Stuff While Ye May,What happens to ducks when they die?
235,235: Do Duck Stuff While Ye May,Have you written your will?
235,235: Do Duck Stuff While Ye May,Why are things blurry even when my face is close to the mirror?
235,235: Do Duck Stuff While Ye May,What should I grow in my garden?
235,235: Do Duck Stuff While Ye May,What should I learn about?
235,235: Do Duck Stuff While Ye May,Can I hang out with ghosts while still practicing social distancing?
235,235: Do Duck Stuff While Ye May,How do you talk while crying?
236,236: Connoisseurs of Our Own Embarrassments,How do I stop being embarrassed by mail?
236,236: Connoisseurs of Our Own Embarrassments,How do I edit my grandpa's book?
236,236: Connoisseurs of Our Own Embarrassments,Is it selfish to cry on your birthday?
236,236: Connoisseurs of Our Own Embarrassments,How do I live in a place with bugs?
236,236: Connoisseurs of Our Own Embarrassments,What is something that took you an embarrassingly long time to find out?
237,237: A Well-Balanced Breakfast,Why have I become nocturnal?
237,237: A Well-Balanced Breakfast,How do I write in a book?
237,237: A Well-Balanced Breakfast,"Where does the phrase ""the high seas"" come from?"
237,237: A Well-Balanced Breakfast,Which fruits are breakfast fruits?
237,237: A Well-Balanced Breakfast,How do I help my mom appreciate art?
237,237: A Well-Balanced Breakfast,How do I deal with negativity on social media?
237,237: A Well-Balanced Breakfast,How big would googly eyes need to be to see them on the moon?
238,238: The Meteor Men,Why don't people paint their houses black?
238,238: The Meteor Men,How do I deal with loneliness?
238,238: The Meteor Men,What are some good triplet pranks?
238,238: The Meteor Men,What are the Google Street View must-see attractions?
238,238: The Meteor Men,What's up with money?
238,238: The Meteor Men,How much is one lock of hair?
238,238: The Meteor Men,"Where can I find a ""Kirskagard"" journal?"
239,259: Infinite Bird,Could the pandemic wipe out lice?
239,259: Infinite Bird,"What's up with the ""birds aren't real"" conspiracy theory?"
